{
  "eventId": "aaaaaaaa-aaaa-4aaa-8aaa-aaaaaaaaaaaa",
  "type": "KnowledgeUpdatedEvent",
  "schemaVersion": 1,
  "occurredAt": "2026-06-08T12:45:00Z",
  "source": "knowledge",
  "traceId": "trace-knowledge-0001",
  "payload": {
    "recordType": "propagationTemplate",
    "recordId": "PROP-TMPL-CORE-IP-042",
    "version": "3",
    "domain": "core-ip"
  }
}
