{
  "eventId": "11111111-1111-4111-8111-111111111111",
  "type": "AlarmEvent",
  "schemaVersion": 1,
  "occurredAt": "2026-06-08T12:34:56Z",
  "source": "simulator",
  "traceId": "trace-alarm-0001",
  "payload": {
    "alarmId": "ALM-0001",
    "managedObjectId": "Port:PE1-LC2-P3",
    "eventType": "communicationsAlarm",
    "probableCause": "lossOfSignal",
    "perceivedSeverity": "critical",
    "raisedAt": "2026-06-08T12:34:55Z",
    "state": "raised",
    "trailIds": []
  }
}
