{
  "eventId": "88888888-8888-4888-8888-888888888888",
  "type": "PatternApprovedEvent",
  "schemaVersion": 1,
  "occurredAt": "2026-06-08T12:41:00Z",
  "source": "pattern-manager",
  "traceId": "trace-approved-0001",
  "payload": {
    "patternId": "PAT-0001",
    "sequence": ["lossOfSignal", "linkDown", "bgpPeerDown"],
    "rootCauseAlarmType": "lossOfSignal",
    "support": 0.42,
    "confidence": 0.87,
    "lift": 3.1,
    "timing": {
      "meanInterArrivalSeconds": 4.5,
      "stdDevSeconds": 1.2
    },
    "codebookMatchId": "SCN-0007",
    "lifecycle": "approved"
  }
}
